{
  "takaroVersion": "0.0.0",
  "name": "gimme",
  "author": "Takaro",
  "supportedGames": [
    "7 days to die",
    "rust",
    "minecraft"
  ],
  "versions": [
    {
      "tag": "1.0.0",
      "description": "Randomly selects item from a list of items and entities. Fixed issue with item identifiers.",
      "configSchema": "{\"$schema\":\"http://json-schema.org/draft-07/schema#\",\"type\":\"object\",\"properties\":{\"items\":{\"x-component\":\"item\",\"type\":\"array\",\"title\":\"Items\",\"description\":\"List of items that a player can receive.\",\"uniqueItems\":true,\"items\":{\"type\":\"object\",\"title\":\"Item\",\"properties\":{\"item\":{\"type\":\"string\",\"title\":\"Item\"},\"amount\":{\"type\":\"number\",\"title\":\"Amount\"},\"quality\":{\"type\":\"string\",\"title\":\"Quality\"}}}},\"commands\":{\"title\":\"Commands\",\"type\":\"array\",\"default\":[\"say hello from gimme\"],\"items\":{\"type\":\"string\"}}},\"required\":[\"items\"],\"additionalProperties\":false}",
      "uiSchema": "{\"items\":{\"items\":{\"item\":{\"ui:widget\":\"item\"}}}}",
      "commands": [
        {
          "name": "gimme",
          "trigger": "gimme",
          "description": null,
          "helpText": "Randomly selects item from a list of items and entities.",
          "function": "import { takaro, data, TakaroUserError } from '@takaro/helpers';\n\nasync function main() {\n  const items = data.module.userConfig.items;\n  const commands = data.module.userConfig.commands;\n\n  if (items.length + commands.length === 0) {\n    throw new TakaroUserError(\n      'No items or commands configured, please ask your server administrator to configure this module.',\n    );\n  }\n\n  // pick a random item between 0 and the length of both the items and commands arrays\n  const randomIndex = Math.floor(Math.random() * (items.length + commands.length));\n  const randomOption = items.concat(commands)[randomIndex];\n\n  if (randomIndex < items.length) {\n    const item = (await takaro.item.itemControllerFindOne(randomOption.item)).data.data;\n    await takaro.gameserver.gameServerControllerGiveItem(data.gameServerId, data.player.id, {\n      name: randomOption.item,\n      amount: randomOption.amount,\n      quality: randomOption.quality ?? '',\n    });\n    await data.player.pm(`You received ${randomOption.amount}x ${item.name}!`);\n  } else {\n    await takaro.gameserver.gameServerControllerExecuteCommand(data.gameServerId, { command: randomOption });\n  }\n}\n\nawait main();\n",
          "arguments": []
        }
      ],
      "hooks": [],
      "cronJobs": [],
      "functions": [],
      "permissions": []
    }
  ]
}
