{
  "takaroVersion": "0.0.0",
  "name": "highPingKicker",
  "author": "Takaro",
  "supportedGames": [
    "7 days to die",
    "rust",
    "minecraft"
  ],
  "versions": [
    {
      "tag": "1.0.0",
      "description": "Automatically kick players with high ping, with warnings and configurable thresholds.",
      "configSchema": "{\"$schema\":\"http://json-schema.org/draft-07/schema#\",\"type\":\"object\",\"properties\":{\"pingThreshold\":{\"type\":\"number\",\"title\":\"Ping threshold\",\"description\":\"A ping value that is deemed too high and prompts a warning.\",\"default\":200,\"minimum\":0},\"warningsBeforeKick\":{\"type\":\"number\",\"title\":\"Kick warnings\",\"description\":\"Number of warnings before a player is kicked.\",\"default\":3,\"minimum\":0}},\"required\":[]}",
      "uiSchema": "{}",
      "commands": [],
      "hooks": [],
      "cronJobs": [
        {
          "name": "Ping check",
          "temporalValue": "*/5 * * * *",
          "description": null,
          "function": "import { takaro, data } from '@takaro/helpers';\n\nconst VARIABLE_KEY = 'highPingKicker:warnings';\n\nasync function main() {\n  const currentPlayers = await takaro.gameserver.gameServerControllerGetPlayers(data.gameServerId);\n\n  await Promise.all(\n    currentPlayers.data.data.map(async (player) => {\n      if (player.ping > data.module.userConfig.pingThreshold) {\n        const takaroPlayerRes = await takaro.player.playerControllerSearch({\n          filters: {\n            steamId: [player.steamId],\n          },\n        });\n\n        const takaroPlayer = takaroPlayerRes.data.data[0];\n\n        const currentWarningsRes = await takaro.variable.variableControllerSearch({\n          filters: {\n            playerId: [takaroPlayer.id],\n            key: [VARIABLE_KEY],\n          },\n        });\n\n        const currentWarningsRecords = currentWarningsRes.data.data;\n\n        let currentWarnings = 1;\n        if (currentWarningsRecords.length) {\n          currentWarnings = parseInt(currentWarningsRecords[0].value, 10) + 1;\n          await takaro.variable.variableControllerUpdate(currentWarningsRecords[0].id, {\n            value: currentWarnings.toString(),\n          });\n        } else {\n          await takaro.variable.variableControllerCreate({\n            playerId: takaroPlayer.id,\n            key: VARIABLE_KEY,\n            value: '1',\n          });\n        }\n\n        // Check if player should be kicked before sending warning\n        if (currentWarnings >= data.module.userConfig.warningsBeforeKick) {\n          await takaro.gameserver.gameServerControllerKickPlayer(data.gameServerId, takaroPlayer.id, {\n            reason: `Your ping (${player.ping}) is too high, please try again later.`,\n          });\n\n          // Delete the warning record after kicking\n          if (currentWarningsRecords.length > 0) {\n            await takaro.variable.variableControllerDelete(currentWarningsRecords[0].id);\n          }\n        } else {\n          // Only send warning if player won't be kicked\n          await takaro.gameserver.gameServerControllerSendMessage(data.gameServerId, {\n            message: `Your ping (${player.ping}) is too high. Warning ${currentWarnings}/${data.module.userConfig.warningsBeforeKick}`,\n            opts: {\n              recipient: {\n                gameId: player.gameId,\n              },\n            },\n          });\n        }\n      }\n    }),\n  );\n}\n\nawait main();\n"
        }
      ],
      "functions": [],
      "permissions": []
    }
  ]
}
