{
  "takaroVersion": "0.0.0",
  "name": "chatBridge",
  "author": "Takaro",
  "supportedGames": [
    "all"
  ],
  "versions": [
    {
      "tag": "1.0.0",
      "description": "Connect chat to other services like Discord.",
      "configSchema": "{\"$schema\":\"http://json-schema.org/draft-07/schema#\",\"type\":\"object\",\"properties\":{\"sendPlayerConnected\":{\"title\":\"Send player connected\",\"type\":\"boolean\",\"description\":\"Send a message when a player connects.\",\"default\":true},\"sendPlayerDisconnected\":{\"title\":\"Send player disconnected\",\"type\":\"boolean\",\"description\":\"Send a message when a player disconnects.\",\"default\":true},\"onlyGlobalChat\":{\"title\":\"Only global chat\",\"type\":\"boolean\",\"default\":true,\"description\":\"Only relay messages from global chat. (no team chat or private messages)\"}},\"additionalProperties\":false}",
      "uiSchema": "{}",
      "commands": [],
      "hooks": [
        {
          "name": "DiscordToGame",
          "eventType": "discord-message",
          "description": null,
          "regex": null,
          "function": "import { takaro, data } from '@takaro/helpers';\n\nasync function main() {\n  try {\n    if (data.eventData.author.isBot) {return;}\n\n    await takaro.gameserver.gameServerControllerSendMessage(data.gameServerId, {\n      message: `[D] ${data.eventData.author.displayName}:  ${data.eventData.msg}`,\n    });\n  } catch (error) {\n    console.error(error);\n    await takaro.discordControllerSendMessage(data.discordChannelId, {\n      message: 'Failed to forward your message to the game. Please try again later.',\n    });\n  }\n}\n\nawait main();\n"
        },
        {
          "name": "GameToDiscord",
          "eventType": "chat-message",
          "description": null,
          "regex": null,
          "function": "import { takaro, data } from '@takaro/helpers';\n\nasync function main() {\n  const onlyGlobal = data.module.userConfig.onlyGlobalChat;\n\n  if (onlyGlobal && data.eventData.channel !== 'global') {return;}\n\n  const discordChannel = data.module.systemConfig.hooks.DiscordToGame.discordChannelId;\n\n  const sender = data.player ? data.player.name : 'Non-player';\n  const message = `**${sender}**: ${data.eventData.msg}`;\n\n  await takaro.discord.discordControllerSendMessage(discordChannel, {\n    message: message,\n  });\n}\n\nawait main();\n"
        },
        {
          "name": "PlayerConnected",
          "eventType": "player-connected",
          "description": null,
          "regex": null,
          "function": "import { takaro, data } from '@takaro/helpers';\n\nasync function main() {\n  const discordChannel = data.module.systemConfig.hooks.DiscordToGame.discordChannelId;\n\n  await takaro.discord.discordControllerSendMessage(discordChannel, {\n    message: `[⚡ Connected]: ${data.player.name}`,\n  });\n}\n\nawait main();\n"
        },
        {
          "name": "PlayerDisconnected",
          "eventType": "player-disconnected",
          "description": null,
          "regex": null,
          "function": "import { takaro, data } from '@takaro/helpers';\n\nasync function main() {\n  const discordChannel = data.module.systemConfig.hooks.DiscordToGame.discordChannelId;\n\n  await takaro.discord.discordControllerSendMessage(discordChannel, {\n    message: `[👋 Disconnected]: ${data.player.name}`,\n  });\n}\n\nawait main();\n"
        }
      ],
      "cronJobs": [],
      "functions": [],
      "permissions": []
    }
  ]
}
